id,text,timestamp,likes,side,event,sentiment
462,"The journey to this point for Man City fans must be surreal. From the days of Stuart Pearce and relegation battles to this. The ultimate glory. Enjoy it, blues. Your club has reached the pinnacle of the footballing world. #MCFC",2023-06-10 22:50:00,1132,Side A,none,Happy
463,"The amount of Inter fans still in the stands, singing their hearts out despite the defeat, is what true support is about. They are proud of their team. This wasn't a humiliation; it was a narrow, brave defeat. #ForzaInter",2023-06-10 23:00:15,1898,Side B,none,Happy
464,"For Inter, this has to be a foundation, not a ceiling. They proved they can mix it with the very best. With a few smart additions in the summer, they can be back here again. The future is bright. #ForzaInter",2023-06-10 23:05:00,876,Side B,none,Happy
465,"I need about a week to decompress from that. The emotional rollercoaster of a Champions League final is unlike anything else in sport. The highest highs and the lowest lows, all within 90 minutes. I'm exhausted. #UCLFinal",2023-06-10 23:10:45,765,Neutral,none,Nervous
466,The sight of thousands of blue flares igniting across Manchester on the live feeds is something to behold. The city is alive with celebration. A night that will be remembered for generations. #MCFC,2023-06-10 23:20:00,1450,Side A,none,Happy
467,"I've just spent 10 minutes trying to explain the significance of the treble to my American roommate. I think he finally gets it after I compared it to winning the Super Bowl, the World Series, and the NBA Finals all in one year. #MCFC",2023-06-10 23:30:00,987,Side A,none,Happy
468,"As the celebrations begin in earnest, you have to wonder where this City team goes from here. They've reached the summit. The challenge now is to stay there. The era of City's dominance might just be beginning. #MCFC",2023-06-10 23:45:00,1001,Side A,none,Happy
469,"Finally turning off the TV. The images are burned into my memory: Haaland's early strike, Lautaro's anguished face, Dzeko's header kissing the post, Rodri's tears, and the confetti falling blue. This is more than a game; it's a collection of moments that tell a story of triumph, heartbreak, and ultimately, footballing history. Goodnight from a truly historic day. #UCLFinal #MCFC #ForzaInter",2023-06-11 00:30:00,2543,Neutral,none,Happy
470,The Champions League anthem never fails to give me chills. This is what football is all about. #UCLFinal,2023-06-10 19:44:30,422,Neutral,none,Happy
471,Can't believe I'm finally watching my team in a Champions League final. Pinch me. #ForzaInter,2023-06-10 19:44:35,289,Side B,none,Excited
472,The tension in the stadium is absolutely palpable. You can feel it through the screen. #UCLFinal,2023-06-10 19:44:40,501,Neutral,none,Nervous
473,Pep Guardiola looks so focused on the touchline. You know he's running through every scenario. #MCFC,2023-06-10 19:44:45,455,Side A,none,Happy
474,Ederson's calmness before a big game is a weapon in itself. Ice in his veins. #MCFC,2023-06-10 19:44:50,398,Side A,none,Happy
475,Let's go City! Bring it home! The treble is on! Come on! #MCFC #UCLFinal,2023-06-10 19:44:55,678,Side A,none,Excited
476,"Inter's midfield of Barella, Brozovic and Calhanoglu is going to be the key battle tonight. #ForzaInter",2023-06-10 19:41:50,345,Side B,none,Neutral
477,The camera just panning across the faces of the fans... some are already in tears. What a moment.,2023-06-10 19:42:10,287,Neutral,none,Nervous
478,Haaland vs Bastoni and Acerbi. That is the matchup I cannot wait to see. Strength vs strength. #UCLFinal,2023-06-10 19:45:20,543,Neutral,none,Excited
479,The pitch looks absolutely pristine. A perfect stage for a final. #UCLFinal,2023-06-10 19:45:30,231,Neutral,none,Happy
480,Hoping for a great game with no injuries and no referee controversy. Let the football do the talking. #UCLFinal,2023-06-10 19:45:40,189,Neutral,none,Happy
481,Remembering the last time Inter won this. Zanetti lifting the trophy. Hoping for that feeling again. #ForzaInter,2023-06-10 19:45:50,415,Side B,none,Happy
482,KDB looks locked in. Please be on it tonight. #MCFC,2023-06-10 19:44:00,562,Side A,none,Happy
483,Lautaro Martinez's movement will cause City's defense so many problems. His runs are incredible. #ForzaInter,2023-06-10 19:42:10,376,Side B,none,Neutral
484,The noise from the Inter end is incredible. Their fans are always so passionate. #UCLFinal,2023-06-10 19:40:20,298,Side B,none,Happy
485,This is it. The biggest game in club football. All the buildup comes down to this. #UCLFinal,2023-06-10 19:41:30,487,Neutral,none,Excited
486,Rodri is so underrated. He is the absolute engine of this City team. Controls everything. #MCFC,2023-06-10 19:40:40,421,Side A,none,Happy
487,Come on Inter! Do it for the legend Zanetti! Black and blue blood! ,2023-06-10 19:44:50,333,Side B,none,Excited
488,Nervous doesn't even begin to describe it. My heart is already racing. #MCFC,2023-06-10 19:44:00,612,Side A,none,Nervous
489,The City fans have been incredible all week in Istanbul. Taking over the city with sky blue. #MCFC,2023-06-10 19:30:15,287,Side A,none,Happy
490,Seeing so many legends in the crowd. Did I just spot Micah Richards and Francesco Totti? #UCLFinal,2023-06-10 19:31:40,455,Neutral,none,Happy
491,Pep's team selection will be fascinating. Will he go with Bernardo or Mahrez on the right? #MCFC,2023-06-10 19:32:50,321,Side A,none,Neutral
492,The Inter ultras have already been singing for an hour non-stop. Incredible dedication. #ForzaInter,2023-06-10 19:33:20,278,Side B,none,Happy
493,This final is a clash of philosophies. Pep's possession vs Inzaghi's organized defensive block. Can't wait. #UCLFinal,2023-06-10 19:34:00,512,Neutral,none,Neutral
494,Remember that goal from Rodri against Aston Villa? We need that guy today. A big game player. #MCFC,2023-06-10 19:34:30,445,Side A,none,Happy
495,The weather in Istanbul is perfect for football. Not too hot! Ideal conditions. #UCLFinal,2023-06-10 19:35:10,198,Neutral,none,Neutral
496,My dad supported Inter his whole life. Wish he could have seen this. Watching for you tonight. #ForzaInter,2023-06-10 19:35:45,687,Side B,none,Nervous
497,Ederson's long passing could be a secret weapon against Inter's press. Launch it for Haaland to chase. #MCFC,2023-06-10 19:36:20,332,Side A,none,Neutral
498,The history of this competition... Inter's back-to-back wins in the 60s. Football heritage. #UCLFinal,2023-06-10 19:37:00,276,Neutral,none,Happy
499,So many friends supporting different teams have messaged good luck. This is what this competition does. Amazing. #MCFC,2023-06-10 19:37:40,421,Side A,none,Happy
500,Dumfries and Dimarco on the wings are so dangerous. Their attacking runs will test Walker and Ake. #ForzaInter,2023-06-10 19:38:15,389,Side B,none,Neutral
501,The pressure is all on City. Everyone expects them to win. Inter can play with freedom as underdogs. #UCLFinal,2023-06-10 19:38:50,554,Neutral,none,Neutral
502,I've got my lucky shirt on; same one I wore for the semi-final. Don't let me down lads! #MCFC,2023-06-10 19:39:25,233,Side A,none,Excited
503,The tifos are going up in the stands. This visual spectacle is part of what makes European finals special. #UCLFinal,2023-06-10 19:40:00,467,Neutral,none,Happy
504,Gundogan's leadership in midfield will be crucial. His experience in these big moments is vital. #MCFC,2023-06-10 19:40:30,398,Side A,none,Neutral
505,Inter's three-at-the-back system is so well drilled. They suffocate teams. City's movement must be sharp. #ForzaInter,2023-06-10 19:41:10,345,Side B,none,Neutral
506,seeing both sets of fans mingling and singing together before the game is what it's all about.,2023-06-10 19:41:50,289,Neutral,none,Happy
508,This is the culmination of a project. Years of building to this exact moment. Let's make it count. #UCLFinal,2023-06-10 19:43:00,501,Neutral,none,Happy
509,The refereeing team for tonight is experienced. Let's hope for a clean game with no drama. #UCLFinal,2023-06-10 19:44:10,245,Neutral,none,Happy
