id,text,timestamp,likes,side,event,sentiment
225,5 minutes! Let's go! We can do this! #ForzaInter,2023-06-10 21:43:05,322,Side B,none,Excited
226,Watching Kyle Walker use his insane pace to recover in the 88th minute and cleanly tackle an Inter attacker who was through on the wing was arguably as important as any goal-saving block. His experience was vital tonight. #MCFC,2023-06-10 21:43:30,955,Side A,none,Excited
227,I can't watch. Someone tell me what happens.,2023-06-10 21:44:05,187,Neutral,none,Nervous
228,THE POST! I CAN'T BELIEVE IT! DZEKO! #Inter,2023-06-10 21:44:15,3215,Side B,none,Shocked
229,INTER HIT THE POST! DZEKO! UNLUCKY!,2023-06-10 21:44:22,3210,Side B,none,Shocked
230,THE POST! I DON'T BELIEVE IT! THE UNLUCKiest TEAM! #Inter,2023-06-10 21:44:35,2987,Side B,none,Shocked
231,The crossbar is still shaking. What a moment.,2023-06-10 21:44:40,987,Neutral,none,Excited
232,The sound of the post will haunt me forever. #Inter,2023-06-10 21:44:50,1124,Side B,none,Nervous
233,"When Dzeko's header hit the post, I actually felt my heart stop. The sound of the ball striking the aluminum is the most gut-wrenching sound in all of sports. The fine margins between immortality and heartbreak. #Inter #UCLFinal",2023-06-10 21:44:50,2876,Side B,none,Nervous
234,The sound of the post will haunt my dreams.,2023-06-10 21:45:00,876,Neutral,none,Nervous
235,I can't believe it. It's not meant to be. #Inter,2023-06-10 21:45:10,452,Side B,none,Angry
236,So unlucky. So so unlucky. #ForzaInter,2023-06-10 21:45:20,876,Side B,none,Angry
237,"The term 'mentality monsters' has been used for other teams, but tonight City earned it. To withstand that second-half onslaught, to see the ball hit the post, and to still not break requires an incredible collective strength. #MCFC",2023-06-10 21:45:30,1332,Side A,none,Excited
238,So close yet so far. 😭 #ForzaInter,2023-06-10 21:45:30,654,Side B,none,Angry
239,It's just meant to be for City. #MCFC,2023-06-10 21:45:40,654,Side A,none,Neutral
240,This is the longest 5 minutes of my life. #MCFC,2023-06-10 21:45:50,211,Side A,none,Nervous
241,Longest 5 minutes of my life. #MCFC,2023-06-10 21:46:05,234,Side A,none,Nervous
242,It's written in the stars for City. #MCFC,2023-06-10 21:46:10,432,Side A,none,Neutral
243,Blow the whistle ref! Please! #MCFC,2023-06-10 21:46:30,421,Neutral,none,Nervous
244,Blow the whistle ref! My heart can't take it! #MCFC,2023-06-10 21:46:40,321,Neutral,none,Nervous
245,So close. So painfully close. #Inter,2023-06-10 21:47:00,444,Side B,none,Nervous
246,FULL TIME! MANCHESTER CITY WIN THE CHAMPIONS LEAGUE!,2023-06-10 21:47:05,5420,Side A,none,Excited
247,Agony. Pure agony. #Inter,2023-06-10 21:47:08,444,Side B,none,Angry
248,FULL TIME! WE'VE DONE IT! CHAMPIONS OF EUROPE! #MCFC,2023-06-10 21:47:10,5421,Side A,none,Excited
249,AND IT'S ALL OVER! MANCHESTER CITY ARE CHAMPIONS OF EUROPE!,2023-06-10 21:47:20,4987,Side A,none,Excited
250,History made. Incredible. #MCFC,2023-06-10 21:47:25,543,Side A,none,Excited
251,HISTORY FOR CITY! TRIPLE COMPLETE! 🏆🏆🏆,2023-06-10 21:47:30,4211,Side A,none,Excited
252,History. Pure history. #MCFC,2023-06-10 21:47:35,654,Side A,none,Excited
253,HISTORY! THE TREBLE IS OURS! 🏆🏆🏆 #MCFC,2023-06-10 21:47:40,4321,Side A,none,Excited
254,"The silence in the Inter end when the final whistle blew was deafening. Then, it was replaced by applause. They know their team gave everything. There's no shame in losing like that. #ForzaInter",2023-06-10 21:47:40,1455,Side B,none,Neutral
255,WE'VE DONE IT! WE'VE FINALLY DONE IT! 😭🔵 #MCFC,2023-06-10 21:47:50,3215,Side A,none,Excited
256,Inter fans still singing. Pure class. 👏,2023-06-10 21:47:55,654,Side B,none,Happy
257,"Full time. No words. Just a hollow feeling. This team fought with everything they had. They left every ounce of themselves on that pitch. We were so, so close. I'm incredibly proud and utterly devastated at the same time. #ForzaInter ❤️🖤",2023-06-10 21:48:00,3456,Side B,none,Angry
258,The Inter fans are still singing. Respect. 👏,2023-06-10 21:48:00,543,Side B,none,Happy
259,I'm actually crying. Tears of joy. #MCFC,2023-06-10 21:48:05,1987,Side A,none,Happy
260,We were robbed. #Inter,2023-06-10 21:48:10,198,Side B,none,Angry
261,We were cheated. #Inter,2023-06-10 21:48:15,198,Side B,none,Angry
262,Heartbroken for Inter. They gave it their all. 😢,2023-06-10 21:48:20,1567,Side B,none,Angry
263,The dream is over. For now. #ForzaInter,2023-06-10 21:48:30,278,Side B,none,Angry
264,Absolutely devastated. We deserved more. #Inter,2023-06-10 21:48:35,1456,Side B,none,Angry
265,Absolute scenes. Tears in my eyes.,2023-06-10 21:48:40,1543,Neutral,none,Nervous
266,The dream is over. For now. #ForzaInter,2023-06-10 21:48:45,278,Side B,none,Angry
267,This is the best day of my life. No cap. #MCFC,2023-06-10 21:48:50,512,Side A,none,Happy
268,Best day of my life. #MCFC,2023-06-10 21:48:55,512,Side A,none,Happy
269,Lukaku was a ghost tonight. Worst on pitch. #Inter,2023-06-10 21:49:05,321,Side B,none,Angry
270,Pep Guardiola is a footballing god. #MCFC,2023-06-10 21:49:05,1123,Side A,none,Happy
271,Pep Guardiola is a genius. No doubt about it.,2023-06-10 21:49:15,1124,Side A,none,Happy
272,Gutted. Absolutely gutted. We deserved more. #Inter,2023-06-10 21:49:30,1298,Side B,none,Angry
273,Lukaku was useless. Offered nothing. #Inter,2023-06-10 21:49:35,345,Side B,none,Angry
274,Heartbreaking. Just heartbreaking. #Inter,2023-06-10 21:49:40,295,Side B,none,Angry
275,Heartbroken. #Inter,2023-06-10 21:49:45,295,Side B,none,Angry
276,Haaland's dream come true. #MCFC,2023-06-10 21:49:50,876,Side A,none,Happy
277,The curse is finally over. #MCFC,2023-06-10 21:49:55,421,Side A,none,Happy
278,Haaland gets his first UCL. Well deserved.,2023-06-10 21:50:00,876,Side A,none,Happy
279,A draw would have been a fair result. #UCLFinal,2023-06-10 21:50:05,287,Neutral,none,Neutral
280,The curse is over! #MCFC,2023-06-10 21:50:05,421,Side A,none,Happy
281,Respect to Inter. They fought like lions. #UCLFinal,2023-06-10 21:50:20,876,Side B,none,Happy
282,"The image of Rodri collapsing to his knees in tears after the final whistle says it all. The pressure, the release, the sheer emotion of achieving the ultimate dream. That's a man who has given everything for this club. #MCFC",2023-06-10 21:50:20,2450,Side A,none,Nervous
283,The curse is broken! We are European Champions! #MCFC,2023-06-10 21:50:25,765,Side A,none,Happy
284,The wait continues... #Inter,2023-06-10 21:50:40,176,Side B,none,Nervous
285,"Inzaghi got his substitutions spot on today. Bringing on Dzeko and later Calhanoglu gave Inter a new lease of life. On another night, with a bit more luck, his changes would have been hailed as genius. He got his game plan right. #Inter",2023-06-10 21:50:45,602,Side B,none,Happy
286,The curse is broken! #MCFC,2023-06-10 21:50:45,654,Side A,none,Happy
287,The players look devastated. Feel for them. #Inter,2023-06-10 21:50:50,333,Side B,none,Angry
288,A draw would've been fair over 90 mins. #UCLFinal,2023-06-10 21:50:55,321,Neutral,none,Neutral
289,The wait goes on... #Inter,2023-06-10 21:51:00,176,Side B,none,Nervous
290,Respect to Inter. They fought until the end. #Respect,2023-06-10 21:51:05,654,Side B,none,Happy
291,The treble is complete. Immortal team. #MCFC,2023-06-10 21:51:10,1122,Side A,none,Happy
292,The players are crushed. Feel for them. #Inter,2023-06-10 21:51:15,333,Side B,none,Angry
293,This one hurts. A lot. #Inter,2023-06-10 21:51:20,234,Side B,none,Angry
294,Celebrating with a pint! Get in! #Champions,2023-06-10 21:51:30,234,Side A,none,Happy
295,The best team won. Simple as. #UCLFinal,2023-06-10 21:51:40,276,Neutral,none,Neutral
296,Where are the haters now? Silence. #MCFC,2023-06-10 21:51:50,543,Side A,none,Happy
297,This really hurts. #Inter,2023-06-10 21:52:00,234,Side B,none,Angry
298,Haaland's first UCL. The first of many.,2023-06-10 21:52:00,765,Side A,none,Happy
299,Respect to Inter. They were the better team in the second half.,2023-06-10 21:52:10,543,Side B,none,Happy
300,Proud of the boys. Left it all out there. #Inter,2023-06-10 21:52:30,321,Side B,none,Happy
301,The best team won over the season. #UCLFinal,2023-06-10 21:52:40,267,Neutral,none,Neutral
302,"Congratulations, City. Well deserved. #Respect",2023-06-10 21:53:00,456,Side A,none,Happy
303,Where are the City haters now? Quiet.,2023-06-10 21:53:05,432,Side A,none,Angry
304,So proud of the effort. #Inter,2023-06-10 21:53:15,321,Side B,none,Happy
305,Pep Guardiola is the greatest manager of all time. Don't @ me.,2023-06-10 21:53:20,987,Side A,none,Happy
306,"Congrats, City. Deserved. #Respect",2023-06-10 21:53:30,456,Side A,none,Happy
307,They've shown the trophy 😍,2023-06-10 21:53:40,433,Side A,none,Happy
308,Onana was brilliant. Our best player. #Inter,2023-06-10 21:54:00,367,Side B,none,Happy
309,The trophy is so shiny. 😍 #MCFC,2023-06-10 21:54:10,432,Side A,none,Happy
310,Onana was our best player. World class. #Inter,2023-06-10 21:54:25,367,Side B,none,Happy
311,The players are crying. What a moment. 😢,2023-06-10 21:54:40,654,Neutral,none,Nervous
312,The players are lifting the trophy! Iconic.,2023-06-10 21:55:00,765,Side A,none,Happy
313,The better team lost tonight. #Inter,2023-06-10 21:55:10,276,Side B,none,Angry
314,"As a neutral, that was a fantastic final. It had everything: an early goal, a shocking miss, a tactical battle, a late injury, a woodwork strike, and relentless tension until the very last second. Football won tonight. #UCLFinal",2023-06-10 21:55:15,1876,Neutral,none,Happy
315,Gundogan lifting the trophy. Captain. Leader. Legend. #MCFC,2023-06-10 21:55:20,987,Side A,none,Happy
316,The better team lost. Football is cruel. #Inter,2023-06-10 21:55:30,276,Side B,none,Angry
317,Gundogan lifting the trophy. Captain fantastic.,2023-06-10 21:55:40,421,Side A,none,Happy
318,Gundogan lifting the big ears. What a season for him. #MCFC,2023-06-10 21:55:55,543,Side A,none,Happy
319,The tears from the players. This means everything. #MCFC,2023-06-10 21:56:00,765,Side A,none,Nervous
320,This is what money can buy. #plastic,2023-06-10 21:56:20,87,Neutral,none,Angry
321,Oil money blah blah. Enjoy the win. #MCFC,2023-06-10 21:56:35,321,Side A,none,Angry
322,Oil money bought this. Nothing more. Plastic club.,2023-06-10 21:56:45,123,Neutral,none,Angry
323,Shut up about the money. Every top team spends. Enjoy the football.,2023-06-10 21:57:15,321,Neutral,none,Angry
324,Cry more. Enjoy the L. We're the best in the world. #MCFC,2023-06-10 21:57:30,276,Side A,none,Angry
325,Grealish is gonna be so hungover tomorrow 😂 #MCFC,2023-06-10 21:57:45,2100,Side A,none,Neutral
326,Already planning the parade in Manchester!,2023-06-10 21:58:00,198,Side A,none,Happy
327,Grealish is absolutely smashed already 😂,2023-06-10 21:58:20,2100,Side A,none,Neutral
328,Manchester is blue! Forever blue! #MCFC,2023-06-10 21:58:30,432,Side A,none,Happy
329,Can't wait for the documentary on this season.,2023-06-10 21:58:50,145,Neutral,none,Excited
330,Pep's tactics were spot on. Neutralized them completely. #MCFC,2023-06-10 21:59:05,556,Side A,none,Happy
331,The parade is going to be insane. Manchester will be blue for weeks.,2023-06-10 21:59:10,321,Side A,none,Happy
332,KDB finally has his UCL medal. So deserved. #MCFC,2023-06-10 21:59:20,654,Side A,none,Happy
333,KDB was quiet today. Still a legend.,2023-06-10 21:59:30,267,Side A,none,Happy
334,Forza Inter sempre. We'll be back. ❤️🖤,2023-06-10 22:00:00,432,Side B,none,Happy
335,Rodri. Man of the Match. No question. #MCFC,2023-06-10 22:00:05,543,Side A,none,Happy
336,Rodri has to be man of the match. Absolute rock.,2023-06-10 22:00:10,412,Side A,none,Happy
337,KDB finally gets his UCL medal. So deserved.,2023-06-10 22:00:30,654,Side A,none,Happy
338,The weight of history is now lifted. No more 'Can they win the Champions League?' questions. This City team has cemented its legacy forever. They are no longer the nearly-men; they are the kings of Europe. #MCFC,2023-06-10 22:00:30,1345,Side A,none,Happy
339,Forza Inter always. ❤️🖤,2023-06-10 22:00:45,432,Side B,none,Happy
340,Akanji was a rock. What a signing. #MCFC,2023-06-10 22:00:50,321,Side A,none,Happy
341,Dias was a wall. MOTM for me. #MCFC,2023-06-10 22:01:00,345,Side A,none,Happy
342,"Well, time to go to bed. Work tomorrow. 😴",2023-06-10 22:01:05,56,Neutral,none,Neutral
343,Rodri was MOTM for me. Controlled everything.,2023-06-10 22:01:15,432,Side A,none,Happy
344,Proud of this team. We'll be back. #ForzaInter,2023-06-10 22:01:30,456,Side B,none,Happy
345,Our fans were incredible all night. 👏,2023-06-10 22:01:40,321,Side B,none,Happy
346,Dias is a colossus. Man of the match for me. #MCFC,2023-06-10 22:01:50,322,Side A,none,Happy
347,What a game of football. This is why it's the beautiful game.,2023-06-10 22:02:00,289,Neutral,none,Happy
348,Premier League dominance. 💙 #MCFC,2023-06-10 22:02:15,234,Side A,none,Happy
349,The Inter fans outsang them all night. 👏,2023-06-10 22:02:20,321,Side B,none,Happy
350,Shoutout to Akanji. Was a rock today. #MCFC,2023-06-10 22:02:40,234,Side A,none,Happy
351,Watching the Haaland goal on repeat. Perfection. #MCFC,2023-06-10 22:03:00,345,Side A,none,Happy
352,Premier League supremacy. 💪,2023-06-10 22:03:20,154,Side A,none,Happy
353,We'll be back. This hurts but I'm proud. #ForzaInter,2023-06-10 22:03:50,456,Side B,none,Happy
354,Pep's interview is so emotional. Love it. #MCFC,2023-06-10 22:04:00,432,Side A,none,Nervous
355,Inter Milan will be back. Mark my words. #ForzaInter,2023-06-10 22:04:15,233,Side B,none,Happy
356,They played with heart. #Inter,2023-06-10 22:04:20,287,Side B,none,Happy
357,Haaland: 'This is just the start.' Scary. #MCFC,2023-06-10 22:04:45,567,Side A,none,Excited
358,"The narrative that City 'bought' the trophy is so lazy. Money is an enabler, but it doesn't teach tactics, it doesn't build team spirit, and it doesn't handle pressure. This victory is a testament to a long-term project, incredible coaching, and player development. #MCFC",2023-06-10 22:05:00,1543,Side A,none,Angry
359,The Premier League has conquered Europe. Again.,2023-06-10 22:05:00,333,Side A,none,Happy
360,Already seeing 'AGUEROOOOOO' but for Haaland. Love it. #MCFC,2023-06-10 22:05:20,456,Side A,none,Happy
361,The memes about Lautaro are brutal but funny. #UCLFinal,2023-06-10 22:05:30,876,Neutral,none,Neutral
362,The amount of oil money in this trophy...,2023-06-10 22:05:40,76,Neutral,none,Angry
363,We played with heart. That's all I ask for. #Inter,2023-06-10 22:05:50,287,Side B,none,Happy
364,"Inter's three-man defense of Acerbi, Bastoni, and Darmian were mostly excellent aside from the early lapse. They dealt with Haaland's physicality well and played out from the back under intense pressure. They can hold their heads high. #Inter",2023-06-10 22:05:50,654,Side B,none,Happy
365,Seeing 'HAAAAALAND' tweets everywhere. Love it. #MCFC,2023-06-10 22:06:00,456,Side A,none,Happy
366,That post from Dzeko... so close. #Inter,2023-06-10 22:06:15,321,Side B,none,Angry
367,Watching the highlights already. That Haaland goal was ruthless.,2023-06-10 22:06:30,222,Side A,none,Happy
368,"Respect from a Liverpool fan. Well done, City. #Respect",2023-06-10 22:07:05,654,Side A,none,Happy
369,Just saw the Haaland goal again. What a finish.,2023-06-10 22:07:10,432,Side A,none,Happy
370,Need a new striker in the summer. #Inter,2023-06-10 22:07:30,189,Side B,none,Neutral
371,Pep's speech is gonna make me cry again.,2023-06-10 22:07:50,198,Side A,none,Nervous
372,"Silva, Dias, Rodri... the whole team was immense.",2023-06-10 22:08:00,198,Side A,none,Happy
373,Need to invest in a striker this summer. #Inter,2023-06-10 22:08:00,189,Side B,none,Neutral
374,The treble. Still sinking in. #MCFC,2023-06-10 22:08:30,543,Side A,none,Happy
375,Haaland: 'This is for the fans.' What a guy. #MCFC,2023-06-10 22:09:10,467,Side A,none,Happy
376,What a night. What a team. #MCFC,2023-06-10 22:09:20,432,Side A,none,Happy
377,I've lost my voice from screaming.,2023-06-10 22:09:30,167,Neutral,none,Nervous
378,City fans everywhere! #MCFC,2023-06-10 22:09:40,333,Side A,none,Happy
379,"From the Etihad to Istanbul, we are everywhere! #MCFC",2023-06-10 22:10:00,333,Side A,none,Happy
380,Changing my profile pic to the trophy lift. #MCFC,2023-06-10 22:10:10,234,Side A,none,Happy
381,Making the final is progress. #Inter,2023-06-10 22:10:30,222,Side B,none,Happy
382,The amount of memes about Lautaro's miss 😂,2023-06-10 22:10:40,789,Neutral,none,Neutral
383,That Lautaro miss will haunt my dreams.,2023-06-10 22:10:50,299,Side B,none,Angry
384,The squad photo is everything. #MCFC,2023-06-10 22:11:00,345,Side A,none,Happy
385,At least we made the final. Progress. #Inter,2023-06-10 22:11:00,222,Side B,none,Happy
386,"I'm not crying, you're crying! #MCFC",2023-06-10 22:11:45,345,Side A,none,Neutral
387,The city of Manchester is blue! 🔵,2023-06-10 22:12:00,345,Side A,none,Happy
388,That shot off the post will be in every 'unlucky moments' video forever. #Inter,2023-06-10 22:12:20,321,Side B,none,Angry
389,Ordering the UCL winners kit right now! #MCFC,2023-06-10 22:12:30,198,Side A,none,Happy
390,"The debate around the 'oil money' tag will rage on, but in this moment, just appreciate the football. Appreciate the coaching, the passing, the tackling, the drama. This was a night for the purists and the neutrals alike. #UCLFinal",2023-06-10 22:12:30,821,Neutral,none,Happy
391,"I'm not crying, you're crying. #MCFC",2023-06-10 22:12:50,345,Side A,none,Neutral
392,No one can question our passion now. #MCFC,2023-06-10 22:13:20,321,Side A,none,Happy
393,Congrats to City fans from a United fan. Deserved win.,2023-06-10 22:13:45,876,Side A,none,Happy
394,"City fans, enjoy it. You deserve it. From a Liverpool fan.",2023-06-10 22:14:00,654,Side A,none,Happy
395,"Inter, you were worthy opponents. #Respect",2023-06-10 22:14:15,456,Side B,none,Happy
396,Focus on Serie A next year. #Inter,2023-06-10 22:14:45,143,Side B,none,Neutral
397,Focus on the league next year. #Inter,2023-06-10 22:15:00,143,Side B,none,Neutral
398,A treble is insane. What an achievement.,2023-06-10 22:15:20,543,Side A,none,Happy
399,The treble. Still can't believe it. #MCFC,2023-06-10 22:15:30,543,Side A,none,Happy
400,"Watching the players celebrate with their families on the pitch is my favorite part. Seeing Haaland with his dad, who probably dreamed of this moment for his son years ago. It's a beautiful, human side to the glitz and glamour. #UCLFinal",2023-06-10 22:15:40,2109,Neutral,none,Happy
401,The offside trap for the goal was a coaching masterpiece. #MCFC,2023-06-10 22:15:40,234,Side A,none,Happy
402,The pitch invader was the highlight for me 😂,2023-06-10 22:16:10,411,Neutral,none,Neutral
403,I don't want this season to end. #MCFC,2023-06-10 22:16:30,187,Side A,none,Nervous
404,What a season. What a night. What a team. 🔵,2023-06-10 22:17:00,432,Side A,none,Happy
405,Thank you for a great season. #Inter,2023-06-10 22:17:10,312,Side B,none,Happy
406,Pep crying got me crying too. #MCFC,2023-06-10 22:17:20,765,Side A,none,Nervous
407,Post-match interviews starting.,2023-06-10 22:17:30,33,Neutral,none,Neutral
408,So much history made tonight. #MCFC,2023-06-10 22:17:45,165,Side A,none,Happy
409,Pep's crying got me crying. #MCFC,2023-06-10 22:18:00,765,Side A,none,Nervous
410,Pep crying. You love to see it.,2023-06-10 22:18:15,654,Side A,none,Happy
411,Time to change my social media banners. #UCLFinal,2023-06-10 22:18:30,156,Neutral,none,Neutral
412,"Thanks for a great season, boys. #Inter",2023-06-10 22:18:40,312,Side B,none,Happy
413,Pitch invaler was the real MVP 😂,2023-06-10 22:18:50,987,Neutral,none,Neutral
414,"Pep Guardiola's post-match interview was pure emotion. The man who is often a tactical robot was overcome with feeling. This trophy meant everything to him, to finally do it with this City team. A weight off his shoulders. #MCFC",2023-06-10 22:18:50,1765,Side A,none,Nervous
415,"Goodnight, everyone. A perfect football night. #UCLFinal",2023-06-10 22:19:00,278,Neutral,none,Neutral
416,The pitch invaler was the highlight of the match let's be real 😂,2023-06-10 22:19:20,876,Neutral,none,Neutral
417,Haaland: 'This is why I came here.',2023-06-10 22:19:40,522,Side A,none,Happy
418,Milan is still proud. #ForzaInter,2023-06-10 22:19:50,256,Side B,none,Happy
419,The winning squad photo is iconic.,2023-06-10 22:20:00,287,Side A,none,Happy
420,"The respect between the two sets of players at the end was heartwarming to see. No bitterness, just mutual appreciation after a brutal battle. Martinez consoling his teammates and then congratulating City players shows true class. #UCLFinal",2023-06-10 22:20:10,1432,Neutral,none,Happy
421,The city of Milan is still proud. #ForzaInter,2023-06-10 22:20:30,256,Side B,none,Happy
422,The long offseason begins... #MCFC,2023-06-10 22:20:45,199,Side A,none,Neutral
423,Already seen 3 fights outside the pub. Calm down lads.,2023-06-10 22:21:00,123,Neutral,none,Neutral
424,Voice is gone. Heart is full. #MCFC,2023-06-10 22:21:30,398,Side A,none,Nervous
425,Already pre-ordering the champions league winner's shirt.,2023-06-10 22:21:40,145,Side A,none,Happy
426,My voice is gone. My heart is full. #MCFC,2023-06-10 22:22:00,467,Side A,none,Nervous
427,"The statistic that City had less possession than their opponent in a final is mind-boggling. It shows they can win in different ways. They can dominate the ball, but they can also dig deep, defend, and suffer together. A complete team. #MCFC",2023-06-10 22:22:00,1124,Side A,none,Happy
428,Where can I buy the champions kit?,2023-06-10 22:22:50,67,Neutral,none,Neutral
429,No one can question our mentality now. #MCFC,2023-06-10 22:23:10,276,Side A,none,Happy
430,This calls for a all-nighter.,2023-06-10 22:24:00,88,Neutral,none,Nervous
431,We will be back for revenge. #Inter,2023-06-10 22:24:10,199,Side B,none,Excited
432,Need that trophy lift as my wallpaper. #MCFC,2023-06-10 22:24:30,222,Side A,none,Happy
433,"Inter, hold your heads high. You made us sweat. #Respect",2023-06-10 22:24:50,398,Side B,none,Happy
434,I need to frame a picture of that trophy lift.,2023-06-10 22:25:00,222,Side A,none,Happy
435,"Post-match analysis is already in full swing. The pundits are rightly praising Rodri as the MOTM. He was imperious. Broke up play, distributed the ball calmly, and was the steady heartbeat of City's performance throughout. A colossal player. #MCFC",2023-06-10 22:25:00,987,Side A,none,Happy
436,The amount of memes from this game will be legendary.,2023-06-10 22:25:30,145,Neutral,none,Neutral
437,We'll get our revenge. #Inter,2023-06-10 22:25:40,199,Side B,none,Excited
438,The offside trap on the goal was perfectly executed. #MCFC,2023-06-10 22:26:20,187,Side A,none,Happy
439,Grealish's celebration with the fans 😍,2023-06-10 22:26:40,567,Side A,none,Happy
440,Can we play the final again tomorrow? I don't want it to end.,2023-06-10 22:28:10,98,Side A,none,Nervous
441,Can we play the Community Shield tomorrow? I need more. 😂,2023-06-10 22:28:30,165,Side A,none,Neutral
442,Logging off. Too painful. #Inter,2023-06-10 22:28:50,167,Side B,none,Angry
443,What a season. Unforgettable. #MCFC,2023-06-10 22:29:40,199,Side A,none,Happy
444,"Well, that's a wrap on the football season. It's been a good one.",2023-06-10 22:30:00,201,Neutral,none,Neutral
445,Time to log off. Too sad. #Inter,2023-06-10 22:30:00,167,Side B,none,Angry
446,The amount of history made tonight...,2023-06-10 22:30:10,143,Neutral,none,Happy
447,"The treble is complete. Premier League, FA Cup, Champions League. It's a feat only achieved by one other English team. Whatever you think of them, you have to respect the sheer, relentless dominance of this achievement. Historic. #MCFC",2023-06-10 22:30:30,2765,Side A,none,Happy
448,What a journey this season. Incredible. #MCFC,2023-06-10 22:31:00,199,Side A,none,Happy
449,Now the transfer rumors begin! Mbappe to City? 😉,2023-06-10 22:31:20,321,Side A,none,Neutral
450,"Good night, football. That was special. #UCLFinal",2023-06-10 22:32:00,231,Neutral,none,Neutral
451,"Thanks for a great season, everyone. #UCLFinal",2023-06-10 22:33:00,187,Neutral,none,Happy
452,Already looking forward to next season. #ForzaInter,2023-06-10 22:33:30,145,Side B,none,Happy
453,"And now we enter the long, dark void of the offseason...",2023-06-10 22:34:00,176,Neutral,none,Angry
454,Highlights are on YouTube already. That was fast.,2023-06-10 22:34:50,76,Neutral,none,Neutral
455,Already excited for next season. #ForzaInter,2023-06-10 22:35:00,145,Side B,none,Happy
456,"Good night, tweeps. Dream of trophies. 🏆",2023-06-10 22:36:00,112,Neutral,none,Happy
457,"And now, the offseason depression sets in...",2023-06-10 22:38:10,455,Neutral,none,Angry
458,The sun will rise. Forza Inter forever. ❤️🖤,2023-06-10 22:38:40,231,Side B,none,Happy
459,"Already seeing the 'Lautaro Miss' memes popping up online. It's brutal, but it comes with the territory. I just hope he has the mental strength to get over this. He's a world-class striker who had a world-class nightmare. #Inter",2023-06-10 22:40:00,654,Side B,none,Angry
460,The sun will rise again. Forza Inter sempre. ❤️🖤,2023-06-10 22:40:00,231,Side B,none,Happy
461,"Just rewatched the build-up to the Haaland goal. It wasn't just De Bruyne. The move started with Rodri winning a tackle in our own half, a simple pass to Gundogan who turned and spotted the run. It was a team goal disguised as a moment of individual brilliance. #MCFC",2023-06-10 22:40:15,567,Side A,none,Happy
